{
  "schema_version": "1.0",
  "event_id": "018f4d7d-0000-7000-8000-000000000008",
  "timestamp": "2026-05-09T20:00:00.000Z",
  "service": {
    "name": "python-fastapi-minimal",
    "language": "python",
    "runtime_version": "3.11.9",
    "sdk_version": "0.1.0"
  },
  "trace_id": "018f4d7d-1111-7000-8000-000000000001",
  "span_id": "018f4d7d-2222-7000-8000-000000000001",
  "parent_span_id": null,
  "kind": "exception_raised",
  "payload": {
    "handled": false,
    "span_name": "HTTP GET /boom",
    "route": {
      "method": "GET",
      "route_pattern": "/boom",
      "route_id": "sha256:boom",
      "redacted_path": "/boom"
    },
    "exception": {
      "type": "ValueError",
      "message": "example failure for validation",
      "fingerprint": "sha256:4fb0",
      "stack_trace": [
        {
          "file": "app/main.py",
          "module": "app.main",
          "function": "boom",
          "line": 42,
          "in_app": true
        }
      ]
    }
  }
}
