{
  "schema_version": "1.0",
  "event_id": "018f4d7d-0000-7000-8000-000000000009",
  "timestamp": "2026-05-09T20:00:00.000Z",
  "service": {
    "name": "python-fastapi-minimal",
    "language": "python",
    "runtime_version": "3.11.9",
    "sdk_version": "0.1.0"
  },
  "trace_id": "018f4d7d-1111-7000-8000-000000000001",
  "span_id": "018f4d7d-2222-7000-8000-000000000001",
  "parent_span_id": null,
  "kind": "db_query",
  "payload": {
    "operation": "SELECT",
    "statement_fingerprint": "SELECT * FROM items WHERE id = ?",
    "statement_template": "SELECT * FROM items WHERE id = ?",
    "parameters": "(42,)",
    "rendered_statement": "SELECT * FROM items WHERE id = 42",
    "tables": [
      "items"
    ],
    "duration_ms": 3.2,
    "row_count": 1,
    "database_system": "sqlite",
    "error": null
  }
}
