{
  "schema_version": "1.0",
  "event_id": "example-log-1",
  "timestamp": "2026-05-09T20:00:00.000Z",
  "service": {
    "name": "example-service",
    "language": "python",
    "runtime_version": "3.11",
    "sdk_version": "0.1.0"
  },
  "trace_id": "018f4d7d-1111-7000-8000-000000000001",
  "span_id": "span-1",
  "parent_span_id": null,
  "kind": "log_record",
  "payload": {
    "level": "INFO",
    "logger_name": "app.example",
    "message": "request handled",
    "structured": {
      "user_id": "<redacted>"
    },
    "correlation_id": "corr_01",
    "route": {
      "method": "GET",
      "route_pattern": "/hello",
      "route_id": "sha256:hello"
    }
  }
}
