{
  "schema_version": "1.0",
  "timestamp": "2026-05-09T20:00:00.000Z",
  "service": {
    "name": "example-api",
    "language": "python",
    "runtime_version": "3.11",
    "sdk_version": "0.1.0"
  },
  "trace_id": "018f4d7d-1111-7000-8000-000000000001",
  "span_id": "018f4d7d-1111-7000-8000-000000000002",
  "parent_span_id": null,
  "event_id": "evt-tool_call",
  "kind": "tool_call",
  "payload": {
    "tool_name": "search_docs",
    "duration_ms": 22.1,
    "status": "ok",
    "input": {
      "query_hash": "sha256:1234"
    },
    "output": {
      "result_count": 2
    }
  }
}
