{
  "schema_version": "1.0",
  "event_id": "018f4d7d-0000-7000-8000-000000000005",
  "timestamp": "2026-05-09T20:00:00.000Z",
  "service": {
    "name": "python-fastapi-minimal",
    "language": "python",
    "runtime_version": "3.11.9",
    "sdk_version": "0.1.0"
  },
  "trace_id": "018f4d7d-1111-7000-8000-000000000001",
  "span_id": "018f4d7d-2222-7000-8000-000000000001",
  "parent_span_id": null,
  "kind": "request_finished",
  "payload": {
    "request_id": "req_01",
    "method": "GET",
    "route_pattern": "/items/{item_id}",
    "route_id": "sha256:0c8d",
    "redacted_path": "/items/<redacted>",
    "status_code": 200,
    "duration_ms": 12.4,
    "response_size_bytes": 81,
    "error": false
  }
}
