{
  "schema_version": "1.0",
  "event_id": "018f4d7d-0000-7000-8000-000000000002",
  "timestamp": "2026-05-09T20:00:00.000Z",
  "service": {
    "name": "python-fastapi-minimal",
    "language": "python",
    "runtime_version": "3.11.9",
    "sdk_version": "0.1.0"
  },
  "trace_id": null,
  "span_id": null,
  "parent_span_id": null,
  "kind": "dependency_inventory",
  "payload": {
    "dependency_file": "pyproject.toml",
    "dependencies": [
      {
        "name": "fastapi",
        "version": "0.111.0",
        "source": "pyproject",
        "type": "runtime"
      },
      {
        "name": "uvicorn",
        "version": "0.30.0",
        "source": "pyproject",
        "type": "runtime"
      }
    ]
  }
}
